EmployeePayRoll SQL:

UC1 : Create payRoll service database.

mysql> SHOW DATABASES;
+--------------------+
| Database           |
+--------------------+
| information_schema |
| mysql              |
| performance_schema |
| sakila             |
| sys                |
| world              |
+--------------------+
6 rows in set (0.22 sec)

mysql> CREATE DATABASE employee;
Query OK, 1 row affected (0.26 sec)

mysql> USE employee
Database changed
======================================================================
UC2 : Create table employeepayroll.

mysql> CREATE TABLE EmployeePayRoll(
    -> id INT not null,
    -> name VARCHAR(100),

    -> salary DOUBLE,
    -> start DATE,
    -> PRIMARY KEY(id)
    -> );
Query OK, 0 rows affected (1.94 sec)
======================================================================
UC3 : Insert values into table.

mysql> INSERT INTO EmployeePayRoll(id,name,salary,start)values
    -> (101,'BILL',100000.00,'2010-01-03'),
    -> (102,'TERISA',200000.00,'2019-11-13'),
    -> (103,'CHARLIE',300000.00,'2020-05-21');
Query OK, 3 rows affected (0.28 sec)
Records: 3  Duplicates: 0  Warnings: 0
======================================================================
UC6 : Add gender.

mysql> update EmployeePayRoll set gender = 'M' where name = 'BILL'
    -> ;
ERROR 1054 (42S22): Unknown column 'gender' in 'field list'
mysql> alter table EmployeePayRoll add gender CHAR(1) after name;
Query OK, 0 rows affected (3.48 sec)
Records: 0  Duplicates: 0  Warnings: 0

mysql> update EmployeePayRoll set gender = 'M' where name = 'BILL';
Query OK, 1 row affected (0.16 sec)
Rows matched: 1  Changed: 1  Warnings: 0

mysql> update EmployeePayRoll set gender = 'M' where name = 'CHARLIE';
Query OK, 1 row affected (0.21 sec)
Rows matched: 1  Changed: 1  Warnings: 0

mysql> update EmployeePayRoll set gender = 'F' where name = 'TERISA';
Query OK, 1 row affected (0.07 sec)
Rows matched: 1  Changed: 1  Warnings: 0
======================================================================
UC4 : Retrieve data.
mysql> SELECT * FROM EMPLOYEEPAYROLL
    -> ;
+-----+---------+--------+--------+------------+
| id  | name    | gender | salary | start      |
+-----+---------+--------+--------+------------+
| 101 | BILL    | M      | 100000 | 2010-01-03 |
| 102 | TERISA  | F      | 200000 | 2019-11-13 |
| 103 | CHARLIE | M      | 300000 | 2020-05-21 |
+-----+---------+--------+--------+------------+
3 rows in set (0.10 sec)

======================================================================
UC5 : Retrieve salary for a particular employee.
 
mysql> SELECT SALARY FROM EMPLOYEEPAYROLL WHERE NAME = 'BILL';
+--------+
| SALARY |
+--------+
| 100000 |
+--------+
1 row in set (0.00 sec)

mysql> SELECT salary FROM EMPLOYEEPAYROLL WHERE start BETWEEN CAST('2018-01-01' AS DATE) AND DATE(NOW());
+--------+
| salary |
+--------+
| 200000 |
| 300000 |
+--------+
2 rows in set (0.13 sec)
======================================================================
UC7 : Sum, average, min, max and number of male and female employees.
mysql>
mysql> SELECT SUM(salary) FROM EmployeePayRoll WHERE gender ='F' GROUP BY gender;
+-------------+
| SUM(salary) |
+-------------+
|      200000 |
+-------------+
1 row in set (0.01 sec)
-----------------------------------------------------------------------------------
mysql> SELECT SUM(salary) FROM EmployeePayRoll WHERE gender ='M' GROUP BY gender;
+-------------+
| SUM(salary) |
+-------------+
|      400000 |
+-------------+
1 row in set (0.13 sec)

-----------------------------------------------------------------------------------
mysql> SELECT avg(salary) FROM EmployeePayRoll WHERE gender ='M' GROUP BY gender;
+-------------+
| avg(salary) |
+-------------+
|      200000 |
+-------------+
1 row in set (0.10 sec)

-----------------------------------------------------------------------------------
mysql> SELECT avg(salary) FROM EmployeePayRoll WHERE gender ='F' GROUP BY gender;
+-------------+
| avg(salary) |
+-------------+
|      200000 |
+-------------+
1 row in set (0.00 sec)

-----------------------------------------------------------------------------------
mysql> SELECT min(salary) FROM EmployeePayRoll WHERE gender ='F' GROUP BY gender;
+-------------+
| min(salary) |
+-------------+
|      200000 |
+-------------+
1 row in set (0.04 sec)

-----------------------------------------------------------------------------------
mysql> SELECT min(salary) FROM EmployeePayRoll WHERE gender ='M' GROUP BY gender;
+-------------+
| min(salary) |
+-------------+
|      100000 |
+-------------+
1 row in set (0.00 sec)

-----------------------------------------------------------------------------------
mysql> SELECT max(salary) FROM EmployeePayRoll WHERE gender ='M' GROUP BY gender;
+-------------+
| max(salary) |
+-------------+
|      300000 |
+-------------+
1 row in set (0.00 sec)

-----------------------------------------------------------------------------------
mysql> SELECT max(salary) FROM EmployeePayRoll WHERE gender ='F' GROUP BY gender;
+-------------+
| max(salary) |
+-------------+
|      200000 |
+-------------+
1 row in set (0.00 sec)

-----------------------------------------------------------------------------------
mysql> SELECT count(id) FROM EmployeePayRoll WHERE gender ='F' GROUP BY gender;
+-----------+
| count(id) |
+-----------+
|         1 |
+-----------+
1 row in set (0.00 sec)

-----------------------------------------------------------------------------------
mysql> SELECT count(id) FROM EmployeePayRoll WHERE gender ='M' GROUP BY gender;
+-----------+
| count(id) |
+-----------+
|         2 |
+-----------+
1 row in set (0.00 sec)
-----------------------------------------------------------------------------------
 use employee_payroll_db
Database changed
mysql> select * from employee_system;
+----+----------+--------+----------+---------------+------------+------------+
| id | name     | gender | salary   | adress        | phone_no   | date_join  |
+----+----------+--------+----------+---------------+------------+------------+
|  1 | Dinithi  | female |   740000 | Candy scty    | 9865412301 | 2015-01-13 |
|  2 | Selam    | female |   140000 | ABC Scty      | 986523100  | 2014-02-10 |
|  3 | Jaspreet | female |   160000 | HIghLand scty | 9998654120 | 2013-01-10 |
|  4 | Harry    | male   |   160000 | BrightLand    | 9874512410 | 2013-01-10 |
|  5 | terisa   | female | 30000000 | chicago       | 42154123   | 2009-01-10 |
|  6 | Jeff     | NULL   |  1000000 | NULL          | NULL       | 2021-03-23 |
|  7 | Mark     | NULL   |  3000000 | NewYork       | NULL       | 2021-03-23 |
|  8 | Jeff     | NULL   |  1000000 | NULL          | NULL       | 2021-03-23 |
|  9 | Mark     | NULL   |  3000000 | NewYork       | NULL       | 2021-03-23 |
| 10 | Mark     | NULL   |  3000000 | NULL          | NULL       | 2021-03-23 |
| 11 | Jeff     | NULL   |  1000000 | NULL          | NULL       | 2021-03-23 |
| 12 | Jeff     | NULL   |  1000000 | NULL          | NULL       | 2021-03-23 |
| 13 | Mark     | NULL   |  3000000 | NULL          | NULL       | 2021-03-23 |
| 14 | Jeff     | NULL   |  1000000 | NULL          | NULL       | 2021-03-23 |
| 15 | Mark     | NULL   |  3000000 | NULL          | NULL       | 2021-03-23 |
| 16 | Jeff     | NULL   |  1000000 | NULL          | NULL       | 2021-03-23 |
| 17 | Mark     | NULL   |  3000000 | NULL          | NULL       | 2021-03-23 |
+----+----------+--------+----------+---------------+------------+------------+
17 rows in set (0.08 sec)

mysql> select name from employee_system where date_join between cast('2000-01-01' as date) and date(now());
+----------+
| name     |
+----------+
| Dinithi  |
| Selam    |
| Jaspreet |
| Harry    |
| terisa   |
| Jeff     |
| Mark     |
| Jeff     |
| Mark     |
| Mark     |
| Jeff     |
| Jeff     |
| Mark     |
| Jeff     |
| Mark     |
| Jeff     |
| Mark     |
+----------+
17 rows in set (0.05 sec)

mysql> select sum(salary) from employee_system where gender='male' group by gender; se
+-------------+
| sum(salary) |
+-------------+
|      160000 |
+-------------+
1 row in set (0.00 sec)

    -> select sum(salary) from employee_system where gender='male' group by gender; se
ERROR 1064 (42000): You have an error in your SQL syntax; check the manual that corresponds to your MySQL server version for the right syntax to use near 'se
select sum(salary) from employee_system where gender='male' group by gender' at line 1
    -> ^C
mysql> select sum(salary) from employee_system where gender='male' group by gender;
+-------------+
| sum(salary) |
+-------------+
|      160000 |
+-------------+
1 row in set (0.00 sec)

mysql> select sum(salary) as sum_salary from employee_system where gender='female' group by gender;
+------------+
| sum_salary |
+------------+
|   31040000 |
+------------+
1 row in set (0.00 sec)

mysql> select avg(salary) as avg_salary from employee_system where gender='male' group by gender;
+------------+
| avg_salary |
+------------+
|     160000 |
+------------+
1 row in set (0.10 sec)

mysql> select avg(salary) as avg_salary from employee_system where gender='female' group by gender;
+------------+
| avg_salary |
+------------+
|    7760000 |
+------------+
1 row in set (0.01 sec)

mysql> select min(salary) as minmum from employee_system where gender='male' group by gender;
+--------+
| minmum |
+--------+
| 160000 |
+--------+
1 row in set (0.13 sec)

mysql> select max(salary) as maximum from employee_system where gender='male' group by gender;
+---------+
| maximum |
+---------+
|  160000 |
+---------+
1 row in set (0.00 sec)

mysql> select min(salary) as minmum from employee_system where gender='female' group by gender;
+--------+
| minmum |
+--------+
| 140000 |
+--------+
1 row in set (0.00 sec)

mysql> select count(salary) as count_salary from employee_system where gender='male' group by gender;
+--------------+
| count_salary |
+--------------+
|            1 |
+--------------+
1 row in set (0.00 sec)

mysql> select * from department;
+---------+-----------+------+
| dept_id | dept_name | id   |
+---------+-----------+------+
|       1 | Marketing |    1 |
|       2 | HR        |    2 |
|       3 | HR        |    4 |
|       4 | Sales     |    3 |
|       5 | Marketing |    5 |
+---------+-----------+------+
5 rows in set (0.23 sec)
